tid,Testimonial_Text,Stars
1,We've been using this utility for years - awesome service!,5
2,This Python app simplified my workflow significantly. Highly recommended.,5
3,"Had a few issues at first, but their support team is top-notch!",4
4,A fantastic tool - it has everything you need and more.,5
5,The interface could be a little more user-friendly.,5
6,Been a fan of this app since day one. It just keeps getting better!,5
7,The recent updates really improved the overall experience.,4
8,A decent web app. There's room for improvement though.,3
9,The app is reliable and efficient. I can't imagine my day without it now.,5
10,Encountered some bugs. Hope they fix it soon.,1
11,This web app is a game-changer! I've boosted my productivity.,5
12,The features are great but it took me a while to understand how to use them.,4
13,Love the simplicity and effectiveness of this app.,4
14,"It's an okay tool, but I've used better.",5
15,Fantastic app! It's made my job so much easier.,5
16,"The learning curve is steep, but it's worth it.",5
17,Great concept but needs more work on the execution.,5
18,This app is innovative and has a lot of potentials. Keep it up!,4
19,"It's a solid tool, but there are some minor issues.",5
20,A great app that delivers on its promises. Very impressed.,5
21,I'm blown away by the features and functionality. Incredible app!,5
22,I'm not satisfied with the app's performance. Disappointing.,1
23,The customer support team went above and beyond to help me. Excellent service!,5
24,"The app crashes frequently, making it unreliable for my needs.",5
25,I've recommended this app to all my colleagues. It's a game-changer!,5
26,The user interface is intuitive and well-designed. Easy to navigate.,5
27,I expected more from this app. It didn't meet my expectations.,5
28,The app's performance has improved significantly with the latest update.,4
29,This app has saved me so much time and effort. Highly efficient!,5
30,"There are some minor bugs, but overall, a solid app.",4
31,"I've tried many similar apps, but this one stands out. Impressive!",4
32,The app's user interface could use some improvements. It feels outdated.,5
33,I'm extremely satisfied with the app's performance. Works like a charm!,5
34,The app's documentation is comprehensive and easy to follow.,4
35,I'm disappointed with the lack of updates and new features.,3
36,This app has become an essential part of my workflow. Highly recommended!,5
37,The app is slow and unresponsive at times. Needs optimization.,2
38,I love the clean and modern design of the app. Pleasing to the eye.,5
39,I've encountered several bugs that hindered my productivity.,2
40,This app has become an indispensable tool for me. Great job!,5
41,The app's user interface is cluttered and confusing. Difficult to navigate.,2
42,"I've been using this app for a while now, and it has become an essential part of my daily routine. Highly recommended!",5
43,The customer support team was unresponsive and unhelpful. Disappointing experience.,1
44,This app has revolutionized the way I work. It's efficient and user-friendly.,5
45,"The app's performance is inconsistent. It works well sometimes, but other times it's slow and unresponsive.",3
46,I'm impressed by the frequent updates and new features added to the app. It keeps getting better!,5
47,"I had high hopes for this app, but it failed to meet my expectations. It lacks important features.",2
48,The app's interface is intuitive and easy to navigate. I didn't face any issues while using it.,5
49,This app is a must-have for anyone in the industry. It streamlines processes and saves time.,5
50,I encountered a critical bug that caused data loss. It was a frustrating experience.,1
51,"The app's design is visually appealing, and the user experience is excellent.",5
52,The app's functionality is limited. It needs more features to be truly useful.,2
53,I've had a positive experience using this app. It has improved my productivity significantly.,4
54,"The app crashes frequently, making it unreliable for daily use.",2
55,The app's customer support team was prompt and helpful in resolving my issues. Great service!,5
56,"I've tried many similar apps, but this one stands out with its exceptional performance and features.",5
57,The app's user interface is outdated and not intuitive. It needs a modern redesign.,2
58,I'm extremely satisfied with this app. It has exceeded my expectations in every way.,5
59,"The app's documentation is comprehensive and easy to follow, making it easy to get started.",5
60,The app's performance has been flawless. I haven't experienced any issues or slowdowns.,5
